### ISSUE TITLE
False result with -probe-all-ips and -ports options

### ISSUE THREAD

**Issue by Code-L0V3R** [projectdiscovery/httpx#596]
I can't use **-probe-all-ips** and **-ports** at the same time. it's showing false result on closed port.

### httpx version:
v1.2.1
### Current Behavior:
```
root@debian:/tmp/# echo docs.hackerone.com | httpx -probe-all-ips -ports 8010

    __    __  __       _  __
   / /_  / /_/ /_____ | |/ /
  / __ \/ __/ __/ __ \|   /
 / / / / /_/ /_/ /_/ /   |
/_/ /_/\__/\__/ .___/_/|_|
             /_/              v1.2.1

		projectdiscovery.io

Use with caution. You are responsible for your actions.
Developers assume no liability and are not responsible for any misuse or damage.
https://docs.hackerone.com [https://:8010/2606:50c0:8001::153]
https://docs.hackerone.com [https://:8010/2606:50c0:8001::153]
https://docs.hackerone.com [https://:8010/2606:50c0:8003::153]
https://docs.hackerone.com [https://:8010/2606:50c0:8003::153]
```
actually, port 8010 is close on docs.hackerone.com and it does not scanning to ipv6 address.
I attached the tcpdump traffic for details.
```
root@debian:/tmp/# tcpdump -i eth0 -n port 8010
tcpdump: verbose output suppressed, use -v[v]... for full protocol decode
listening on eth0, link-type EN10MB (Ethernet), snapshot length 262144 bytes
10:50:56.900391 IP 172.16.0.129.54760 > 185.199.108.153.8010: Flags [S], seq 2166702042, win 29200, options [mss 1460,sackOK,TS val 2389998053 ecr 0,nop,wscale 7], length 0
10:50:56.907195 IP 172.16.0.129.54762 > 185.199.108.153.8010: Flags [S], seq 233142148, win 29200, options [mss 1460,sackOK,TS val 2389998054 ecr 0,nop,wscale 7], length 0
10:50:56.940708 IP 172.16.0.129.54772 > 185.199.108.153.8010: Flags [S], seq 1271703447, win 29200, options [mss 1460,sackOK,TS val 2389998063 ecr 0,nop,wscale 7], length 0
10:50:56.946815 IP 172.16.0.129.54774 > 185.199.108.153.8010: Flags [S], seq 2786929265, win 29200, options [mss 1460,sackOK,TS val 2389998064 ecr 0,nop,wscale 7], length 0
10:50:57.923443 IP 172.16.0.129.54760 > 185.199.108.153.8010: Flags [S], seq 2166702042, win 29200, options [mss 1460,sackOK,TS val 2389998309 ecr 0,nop,wscale 7], length 0
10:50:57.923558 IP 172.16.0.129.54762 > 185.199.108.153.8010: Flags [S], seq 233142148, win 29200, options [mss 1460,sackOK,TS val 2389998309 ecr 0,nop,wscale 7], length 0
10:50:57.955448 IP 172.16.0.129.54774 > 185.199.108.153.8010: Flags [S], seq 2786929265, win 29200, options [mss 1460,sackOK,TS val 2389998317 ecr 0,nop,wscale 7], length 0
10:50:57.959448 IP 172.16.0.129.54772 > 185.199.108.153.8010: Flags [S], seq 1271703447, win 29200, options [mss 1460,sackOK,TS val 2389998318 ecr 0,nop,wscale 7], length 0
10:50:59.939452 IP 172.16.0.129.54760 > 185.199.108.153.8010: Flags [S], seq 2166702042, win 29200, options [mss 1460,sackOK,TS val 2389998813 ecr 0,nop,wscale 7], length 0
10:50:59.939585 IP 172.16.0.129.54762 > 185.199.108.153.8010: Flags [S], seq 233142148, win 29200, options [mss 1460,sackOK,TS val 2389998813 ecr 0,nop,wscale 7], length 0
10:50:59.971441 IP 172.16.0.129.54774 > 185.199.108.153.8010: Flags [S], seq 2786929265, win 29200, options [mss 1460,sackOK,TS val 2389998821 ecr 0,nop,wscale 7], length 0
10:50:59.971501 IP 172.16.0.129.54772 > 185.199.108.153.8010: Flags [S], seq 1271703447, win 29200, options [mss 1460,sackOK,TS val 2389998821 ecr 0,nop,wscale 7], length 0
10:51:03.971456 IP 172.16.0.129.54760 > 185.199.108.153.8010: Flags [S], seq 2166702042, win 29200, options [mss 1460,sackOK,TS val 2389999821 ecr 0,nop,wscale 7], length 0
10:51:03.975450 IP 172.16.0.129.54762 > 185.199.108.153.8010: Flags [S], seq 233142148, win 29200, options [mss 1460,sackOK,TS val 2389999822 ecr 0,nop,wscale 7], length 0
10:51:04.227448 IP 172.16.0.129.54772 > 185.199.108.153.8010: Flags [S], seq 1271703447, win 29200, options [mss 1460,sackOK,TS val 2389999885 ecr 0,nop,wscale 7], length 0
10:51:04.227585 IP 172.16.0.129.54774 > 185.199.108.153.8010: Flags [S], seq 2786929265, win 29200, options [mss 1460,sackOK,TS val 2389999885 ecr 0,nop,wscale 7], length 0
10:51:06.901090 IP 172.16.0.129.54776 > 185.199.108.153.8010: Flags [S], seq 882189986, win 29200, options [mss 1460,sackOK,TS val 2390000553 ecr 0,nop,wscale 7], length 0
10:51:06.908079 IP 172.16.0.129.54778 > 185.199.108.153.8010: Flags [S], seq 2541808243, win 29200, options [mss 1460,sackOK,TS val 2390000555 ecr 0,nop,wscale 7], length 0
10:51:06.941422 IP 172.16.0.129.54780 > 185.199.108.153.8010: Flags [S], seq 2638685876, win 29200, options [mss 1460,sackOK,TS val 2390000563 ecr 0,nop,wscale 7], length 0
10:51:06.947706 IP 172.16.0.129.54782 > 185.199.108.153.8010: Flags [S], seq 2145167225, win 29200, options [mss 1460,sackOK,TS val 2390000565 ecr 0,nop,wscale 7], length 0
10:51:07.907447 IP 172.16.0.129.54776 > 185.199.108.153.8010: Flags [S], seq 882189986, win 29200, options [mss 1460,sackOK,TS val 2390000805 ecr 0,nop,wscale 7], length 0
10:51:07.939443 IP 172.16.0.129.54778 > 185.199.108.153.8010: Flags [S], seq 2541808243, win 29200, options [mss 1460,sackOK,TS val 2390000813 ecr 0,nop,wscale 7], length 0
10:51:07.971443 IP 172.16.0.129.54780 > 185.199.108.153.8010: Flags [S], seq 2638685876, win 29200, options [mss 1460,sackOK,TS val 2390000821 ecr 0,nop,wscale 7], length 0
10:51:07.971503 IP 172.16.0.129.54782 > 185.199.108.153.8010: Flags [S], seq 2145167225, win 29200, options [mss 1460,sackOK,TS val 2390000821 ecr 0,nop,wscale 7], length 0
10:51:09.923444 IP 172.16.0.129.54776 > 185.199.108.153.8010: Flags [S], seq 882189986, win 29200, options [mss 1460,sackOK,TS val 2390001309 ecr 0,nop,wscale 7], length 0
10:51:09.955445 IP 172.16.0.129.54778 > 185.199.108.153.8010: Flags [S], seq 2541808243, win 29200, options [mss 1460,sackOK,TS val 2390001317 ecr 0,nop,wscale 7], length 0
10:51:09.987444 IP 172.16.0.129.54782 > 185.199.108.153.8010: Flags [S], seq 2145167225, win 29200, options [mss 1460,sackOK,TS val 2390001325 ecr 0,nop,wscale 7], length 0
10:51:09.987553 IP 172.16.0.129.54780 > 185.199.108.153.8010: Flags [S], seq 2638685876, win 29200, options [mss 1460,sackOK,TS val 2390001325 ecr 0,nop,wscale 7], length 0
10:51:13.955464 IP 172.16.0.129.54776 > 185.199.108.153.8010: Flags [S], seq 882189986, win 29200, options [mss 1460,sackOK,TS val 2390002317 ecr 0,nop,wscale 7], length 0
10:51:14.211464 IP 172.16.0.129.54782 > 185.199.108.153.8010: Flags [S], seq 2145167225, win 29200, options [mss 1460,sackOK,TS val 2390002381 ecr 0,nop,wscale 7], length 0
10:51:14.211595 IP 172.16.0.129.54780 > 185.199.108.153.8010: Flags [S], seq 2638685876, win 29200, options [mss 1460,sackOK,TS val 2390002381 ecr 0,nop,wscale 7], length 0
10:51:14.211604 IP 172.16.0.129.54778 > 185.199.108.153.8010: Flags [S], seq 2541808243, win 29200, options [mss 1460,sackOK,TS val 2390002381 ecr 0,nop,wscale 7], length 0
```

### Anything else:
btw, my ipv6 is working. 
```
root@debian:/tmp/# ping -6 -c 1 google.com
PING google.com(sf-in-f102.1e100.net (2404:6800:4003:c03::66)) 56 data bytes
64 bytes from sf-in-f102.1e100.net (2404:6800:4003:c03::66): icmp_seq=1 ttl=109 time=44.9 ms
```
